"nominm"	"nomvial"	"tipoinm"	"nomasen"	"nom_loc"	"nom_mun"	"nom_ent"	"lon"	"lat"
"desplazados por asuntos polticos"	"dif municipal"	"otros"	""	"aldama"	"aldama"	"chiapas"	-93.079917	16.755244
"escuela primaria emiliano zapata"	"cabecera municipal // siguen las mismas personas"	"escuela"	""	"amatn"	"amatn"	"chiapas"	-92.816636	17.385269
"otro uno"	"av central oriente"	"otros"	""	"chamula"	"chamula"	"chiapas"	-93.090248	16.63027
"esc. prim. federal "	"a. av. norte "	"escuela"	""	"chapultenango"	"chapultenango"	"chiapas"	-93.13244658	17.33742666
"domo cancha pblica "	"parque central "	"otros"	""	"chapultenango"	"chapultenango"	"chiapas"	-93.124207	17.337427
"casa ejidal"	"a. sur entre a. y a. poniente tenochtitlan"	"casa"	""	"cintalapa de figueroa"	"cintalapa de figueroa"	"chiapas"	-93.75741348	16.64723224
"iglesia santo domingo"	"av. guerrero norte s/n. col. centro"	"otros"	""	"escuintla"	"escuintla"	"chiapas"	-92.65148419	15.32808683
"esc.sec. tec. no."	"ignacio allende s/n"	"escuela"	""	"escuintla"	"escuintla"	"chiapas"	-92.658297	15.315402
"esc. prim. miguel hidalgo y costilla"	"av. rio cintalapa s/n."	"escuela"	""	"escuintla"	"escuintla"	"chiapas"	-92.64873761	15.32808683
"auditorio municipal"	"cab. municipal"	"auditorio"	""	"ixtacomitn"	"ixtacomitn"	"chiapas"	-93.09663935	17.43273968
"auditorio municipal"	"cabecera municipal // siguen las mismas personas"	"auditorio"	""	"jaltenango de la paz (ngel albino corzo)"	"jaltenango de la paz (ngel albino corzo)"	"chiapas"	-92.723577	15.872286
"esc.sec.dr.belisario dominguez"	"a y a. oriente bulevard galdino rios"	"escuela"	""	"jiquipilas"	"jiquipilas"	"chiapas"	-93.64975668	16.66650288
"salon anexo a la iglesia de san lucas"	"cabecera municipal   // "	"otros"	""	"san lucas"	"san lucas"	"chiapas"	-92.71700798	16.61137997
"esc. conalep "	"cabecera municipal"	"escuela"	""	"tuxtla chico"	"tuxtla chico"	"chiapas"	-92.17371583	14.92983668
"salon san jose"	"cabecera municipal"	"otros"	""	"tuxtla chico"	"tuxtla chico"	"chiapas"	-92.16838628	14.94191868
"esc. sec. tecnica n "	"av. juarez, entre calle privada y calle independencia"	"escuela"	""	"tuxtla chico"	"tuxtla chico"	"chiapas"	-92.16882348	14.9353724
"esc. prim. francisco sarabia "	"av. diaz s/n entre calle ocampo y calle madero"	"escuela"	""	"tuxtla chico"	"tuxtla chico"	"chiapas"	-92.16731876	14.9368211
"esc. prim. club de leones"	"calle nueva s/n entre av. diaz y camino trapiche"	"escuela"	""	"tuxtla chico"	"tuxtla chico"	"chiapas"	-92.16388285	14.94516841
"esc. prim. colegio mexico"	"prolongacion av. alvaro obregon"	"escuela"	""	"tuxtla chico"	"tuxtla chico"	"chiapas"	-92.171403	14.936217
"una noche  digna"	"a. poniente norte no.  col. centro // sigue sin novedad"	"otros"	""	"tuxtla gutirrez"	"tuxtla gutirrez"	"chiapas"	-93.10100542	16.81573984
"instituto de proteccion civil"	"carretera emiliano zapata  kil.."	"otros"	""	"tuxtla gutirrez"	"tuxtla gutirrez"	"chiapas"	-93.17144394	16.7241663
"nuevo refugio"	"calzada sumidero"	"otros"	""	"aguacatillo"	"aguacatillo"	"chiapas"	-92.19486247	16.35242635
"esc. prim.venustiano carranza"	"puerto  arista"	"escuela"	""	"puerto arista"	"puerto arista"	"chiapas"	-93.36936951	15.95340684
"esc sec aabelardo de la torre grajales"	"col america libre"	"escuela"	""	"amrica libre"	"amrica libre"	"chiapas"	-93.00441753	16.69144746
"iglesia pentecostes"	"no disponible"	"otros"	""	"miguel aldama"	"miguel aldama"	"chiapas"	-93.13778296	17.87293367
"esc. prim. vicente guerrero"	"calle central"	"escuela"	""	"silvano gatica"	"silvano gatica"	"chiapas"	-92.20604181	14.95955582
"casa ejidal ejido amado nervo"	"ejido amado nervo"	"casa"	""	"amado nervo"	"amado nervo"	"chiapas"	-92.33528137	17.18081105
"salon de actos"	"amparo agua tinta"	"otros"	""	"amparo agua tinta"	"amparo agua tinta"	"chiapas"	-91.6490221	16.08705259
"cas ejidal"	"amparo agua tinta"	"otros"	""	"amparo agua tinta"	"amparo agua tinta"	"chiapas"	-91.65309906	16.08705259
"casa ejidal"	"poblado el beneficio"	"casa"	""	"el beneficio"	"el beneficio"	"chiapas"	-93.02261353	17.43708726
"esc. prim. benito juarez"	"calle central, frente al parque"	"escuela"	""	"guadalupe victoria"	"guadalupe victoria"	"chiapas"	-92.25022316	14.80405767
"localidad linda vista ii secc."	"salon de usos multiples de la comunidad cuyo"	"otros"	""	"cuyo (lvaro obregn)"	"cuyo (lvaro obregn)"	"chiapas"	-92.01118469	17.71402325
"esc  prim jaime nuno"	"localidad alvaro obregon //"	"escuela"	""	"cuyo (lvaro obregn)"	"cuyo (lvaro obregn)"	"chiapas"	-92.011314	17.72651622
"casa ejidal"	"calle ctral. s/n"	"casa"	""	"guadalupe victoria"	"guadalupe victoria"	"chiapas"	-92.4149759	15.14457662
"caplilla san agustin"	"comunidad san agustin"	"otros"	""	"san agustn"	"san agustn"	"chiapas"	-92.216311	14.992852
"escuela primaria justo sierra "	"ria. galeana a. seccion "	"escuela"	""	"galeana ra. seccin"	"galeana ra. seccin"	"chiapas"	-93.15252112	17.61150154
"esc. primaria rafael ramirez"	"ejido la gloria"	"escuela"	""	"la gloria"	"la gloria"	"chiapas"	-92.99240112	17.49669087
"esc. teles. federal"	"ej. la gloria centro"	"escuela"	""	"la gloria"	"la gloria"	"chiapas"	-91.817024	16.000101
"telebachillerato no. "	"ej. la gloria centro"	"otros"	""	"la gloria"	"la gloria"	"chiapas"	-91.96288	15.963612
"esc. prim. lic. benito juarez"	"calle central, frente al parque"	"escuela"	""	"manuel lazos"	"manuel lazos"	"chiapas"	-92.186424	14.971444
"esc.telesecundaria benemerito de las americas"	"bellavista"	"escuela"	""	"bellavista"	"bellavista"	"chiapas"	-92.125753	15.084201
"jardin de nios francisco contreras galvez"	"no disponible"	"escuela"	""	"san miguel da. seccin"	"san miguel da. seccin"	"chiapas"	-92.131184	16.248089
"esc. prim. jose vasconcelos"	"santo domingo"	"escuela"	""	"santo domingo"	"santo domingo"	"chiapas"	-92.106967	15.029873
"er. congreso de anhuac"	"la laguna"	"escuela"	"comunidad"	"la laguna"	"eduardo neri"	"guerrero"	-99.499389	17.54193
"centro de estudios tec. del mar"	"acapulco - pie de la cuesta km "	"escuela"	"municipio"	"acapulco"	"acapulco de jurez"	"guerrero"	-99.947763	16.880894
"esc. prim. mara orozco de marrn"	"hilario malpica"	"escuela"	"municipio"	"acapulco"	"acapulco de jurez"	"guerrero"	-99.844759	16.853385
"esc. prim. cuauhtmoc"	"zacatula"	"escuela"	"comunidad"	"zacatula"	"la unin"	"guerrero"	-102.178037	18.008662
"centro bachillerato agropecuario cbta no. "	"cacalutla"	"escuela"	"comunidad"	"cacalutla"	"atoyac de lvarez"	"guerrero"	-100.357152	17.127069
"comisaria municipal"	"ejido viejo"	"otro"	"comunidad"	"ejido viejo"	"coyuca de bentez"	"guerrero"	-100.086964	17.007339
"iglesia"	"barra de potos"	"otro"	"comunidad"	"barra de potos"	"petatln"	"guerrero"	-101.273773	17.538241
"jardn de nios antonio casoo"	"san jeronimito"	"escuela"	"comunidad"	"san jeronimito"	"petatln"	"guerrero"	-101.3459813	17.56244393
"asociacin ganadera"	"independencia"	"otro"	"comunidad"	"petatln"	"petatln"	"guerrero"	-101.270822	17.535844
"comisaria municipal"	"papanoa"	"otro"	"comunidad"	"papanoa"	"tecpan de galeana"	"guerrero"	-100.632361	17.222675
"colegio de bachilleres"	"tlalixtaquilla-tlapa km +"	"escuela"	"municipio"	"tlalixtaquilla"	"tlalixtaquilla"	"guerrero"	-98.371686	17.587843
"unidad deportiva"	"punta maldonado"	"deportivo"	"comunidad"	"punta maldonado"	"cuajinicuilapa"	"guerrero"	-98.400841	16.464752
"iglesia parroquial"	"morelos"	"otro"	"municipio"	"juchitn"	"juchitn"	"guerrero"	-98.635958	16.626694
"comisaria ejidal"	"morelos"	"otro"	"municipio"	"juchitn"	"juchitn"	"guerrero"	-98.63623177	16.62695738
"esc. sec. gral. tefilo olea leyva"	"hidalgo"	"escuela"	"municipio"	"juchitn"	"juchitn"	"guerrero"	-98.639816	16.625208
"escuela conalep "	"av. galeana no.  col.  casas"	"escuela"	"lzaro crdenas"	"lzaro crdenas"	"lzaro crdenas"	"michoacn de ocampo"	-102.21652	17.970708
"escuela ignacio lopez rayon"	"av. reforma no.  col. centro"	"escuela"	"lzaro crdenas"	"lzaro crdenas"	"lzaro crdenas"	"michoacn de ocampo"	-102.190298	17.958662
"escuela vicente guerrero"	"av. heroica esc. naval s/n"	"escuela"	"lzaro crdenas"	"lzaro crdenas"	"lzaro crdenas"	"michoacn de ocampo"	-102.199363	17.959949
"auditorio tecnologico"	"av. melchor ocampo no.  col. to sector"	"escuela"	"lzaro crdenas"	"lzaro crdenas"	"lzaro crdenas"	"michoacn de ocampo"	-102.231832	17.972692
"escuela inced"	"av. circunvalacin no.  campamento obrero"	"escuela"	"guacamayas"	"guacamayas"	"lzaro crdenas"	"michoacn de ocampo"	-102.209587	18.026749
"esc. sec. fed. lzaro crdenas"	"av. maracaibo s/n col. fco. j. mujica"	"escuela"	"guacamayas"	"guacamayas"	"lzaro crdenas"	"michoacn de ocampo"	-102.208901	18.02103
"instalaciones del dif municipal"	"ubicado en la calle  de mayo s/n col. centro"	"refugio"	""	""	"san juan bautista lo de soto"	"oaxaca"	-98.421401	16.473591
"casa del pueblo"	"ubicado en la colonia centro."	"refugio"	""	""	"santo domingo armenta"	"oaxaca"	-96.724695	17.05637
"cebetis no. "	"ubicado en calle raul gonzlez esq. china puerto escondido"	"refugio"	""	""	"san pedro mixtepec"	"oaxaca"	-97.087475	15.87951
"escuela justo sierra"	"ubicada en ave. costa chica s/n puerto escondido."	"refugio"	""	""	"san pedro mixtepec"	"oaxaca"	-97.082903	15.872697
"escuela primaria  de marzo"	"ubicada en  oriente y  norte en puerto escondido"	"refugio"	""	""	"san pedro mixtepec"	"oaxaca"	-97.085573	15.982925
"escuela miguel hidalgo y costilla"	"ubicada en ave. laureles s/n col. san miguel del puerto. puerto escondido."	"refugio"	""	""	"san pedro mixtepec"	"oaxaca"	-97.065315	15.886901
"escuela primaria vicente guerrero"	"ubicada en la calle mediterraneo puerto escondido"	"refugio"	""	""	"san pedro mixtepec"	"oaxaca"	-97.069523	15.876174
"escuela secundaria tecnica no. "	"ubicada en el camino a puerto angelito y  norte en puerto escondido"	"refugio"	""	""	"san pedro mixtepec"	"oaxaca"	-97.074192	15.861823
"escuela primaria hermenegildo galeana"	"ubicada en calle  de febrero s/n puerto escondido."	"refugio"	""	""	"san pedro mixtepec"	"oaxaca"	-97.081619	15.885968
"agencia municipal san andres copala"	"ubicada en la poblacion del mismo nombre"	"refugio"	""	""	"san pedro mixtepec"	"oaxaca"	-97.144665	15.997151
"iglesia catolica de san andres copala"	"ubicada en domicilio conocido san andres copala"	"refugio"	""	""	"san pedro mixtepec"	"oaxaca"	-97.144362	15.999864
"escuela primaria revolucin"	"ubicada en domicilio conocido san andres copala"	"refugio"	""	""	"san pedro mixtepec"	"oaxaca"	-97.144682	15.998526
"centro de salud"	"ubicada en domicilio conocido san andres copala"	"refugio"	""	""	"san pedro mixtepec"	"oaxaca"	-97.076506	15.868181
"escuela primaria benito juarez"	"ubicada en domicilio conocido san andres copala"	"refugio"	""	""	"san pedro mixtepec"	"oaxaca"	-96.981444	15.985978
"escuela secundaria"	"ubicada en el centro la reforma en san pedro mixtepec"	"refugio"	""	""	"san pedro mixtepec"	"oaxaca"	-97.084959	15.879356
"jardin de nios"	"ubicado en centro las reforma mixtepec"	"refugio"	""	""	"san pedro mixtepec"	"oaxaca"	-97.082025	15.88168
"agencia municipal la reforma"	"ubicada en el centro de la poblacin"	"refugio"	""	""	"san pedro mixtepec"	"oaxaca"	-97.071482	15.862531
"escuela telesecundaria"	"ubicada en el salitre mixtepec"	"refugio"	""	""	"san pedro mixtepec"	"oaxaca"	-96.981392	15.985946
"escuela primaria lic. adolfo lopez mateos"	"ubicada en calle principal el salitre mixtepec"	"refugio"	""	""	"san pedro mixtepec"	"oaxaca"	-97.003095	15.954369
"palacio municipal de san pedro mixtepec"	"ubicada en colonia centro de san pedro mixtepec"	"refugio"	""	""	"san pedro mixtepec"	"oaxaca"	-97.083716	15.982623
"cobao "	"ubicado en el sector cobao a la salida a la reforma"	"refugio"	""	""	"san pedro mixtepec"	"oaxaca"	-97.069814	15.976529
"escuela secundaria tecnica no. "	"ubicada en ave. constitucin san pedro mixtepec"	"refugio"	""	""	"san pedro mixtepec"	"oaxaca"	-97.072809	15.977656
"escuela primaria miguel hidalgo"	"ubicada en la plaza principal san pedro mixtepec"	"refugio"	""	""	"san pedro mixtepec"	"oaxaca"	-97.069236	15.881414
"escuela primaria emiliano zapata"	"ubicada en el huarumbo mixtepec"	"refugio"	""	""	"san pedro mixtepec"	"oaxaca"	-96.679534	17.059664
"escuela primaria guadalupe victoria"	"ubicada en el toledo mixtepec"	"refugio"	""	""	"san pedro mixtepec"	"oaxaca"	-97.063048	15.998306
"centro comunitario educacion"	"ubicado en la caada mixtepec"	"refugio"	""	""	"san pedro mixtepec"	"oaxaca"	-96.282292	16.271516
"cobao "	"ubicado en  de mayo en bajos de chila"	"refugio"	""	""	"san pedro mixtepec"	"oaxaca"	-97.127446	15.918922
"escuela primarioa antonio caso"	"ubicado en calle  de abril s/n bajos de chila"	"refugio"	""	""	"san pedro mixtepec"	"oaxaca"	-97.115667	15.921622
"jardin de nios carmen baez"	"ubicado en ave.  de septiembre bajos de chila"	"refugio"	""	""	"san pedro mixtepec"	"oaxaca"	-97.121507	15.930028
"agencia municipal de bajos de chila"	"ubicada en el centro de la poblacion"	"refugio"	""	""	"san pedro mixtepec"	"oaxaca"	-97.120055	15.922499
"escuela primaria miguel hidalgo y costilla"	"ubicado en aguazarca en la calle principal"	"refugio"	""	""	"villa de tututepec de melchor ocampo"	"oaxaca"	-96.979095	17.772989
"escuela primaria"	"ubicada en la comunidad de palma sola en la calle principal"	"refugio"	""	""	"villa de tututepec de melchor ocampo"	"oaxaca"	-97.61561	16.091008
"casa ejidal               "	" de septiembre "	"casa"	""	"el retiro"	"el retiro"	"chiapas"	-92.41428925	15.146565
"casa ejidal"	"san isidro"	"casa"	""	"san isidro"	"san isidro"	"chiapas"	-91.7116785	16.38363816
"escuela primaria belisario dominguez"	"cabecera municipal"	"escuela"	""	"nuevo milenio"	"nuevo milenio"	"chiapas"	-93.339844	17.405138
"escuela primaria belisario dominguez"	"cabecera municipal"	"escuela"	""	"nuevo milenio"	"nuevo milenio"	"chiapas"	-93.33984375	17.4051378
"escuela primaria federal bilingue en el barrio buena vista  "	" barrio buena vista  "	"escuela"	""	"pavencul"	"pavencul"	"chiapas"	-92.2164917	15.3342933
"casa ejidal de pavencul"	"domicilio pavencul"	"casa"	""	"pavencul"	"pavencul"	"chiapas"	-92.20212232	14.86283756
"iglesia pentecostes"	"cabecera municipal"	"otros"	""	"la paz"	"la paz"	"chiapas"	-92.71431	15.872846
"casa ejidal"	"ejido la paz"	"casa"	""	"la paz"	"la paz"	"chiapas"	-93.09402466	16.16126144
"casa ejidal"	"san pedro yutniotic"	"casa"	""	"san pedro yutniotic"	"san pedro yutniotic"	"chiapas"	-91.36230469	16.13388986
"escuela primario nios heroes"	"sacuala mpio de chicomuselo"	"escuela"	""	"san francisco"	"san francisco"	"chiapas"	-92.285757	15.742789
"escuela primaria emiliano zapata"	"poblado xochicalco                       //"	"escuela"	""	"poblado xochicalco"	"poblado xochicalco"	"chiapas"	-92.55838222	15.21669947
"esc. primaria justo sierra"	"ejido rancho nuevo"	"escuela"	""	"cantn san fernando"	"cantn san fernando"	"chiapas"	-92.44720459	15.14438091
"salon de actos"	"colonia leningrado"	"otros"	""	"leningrado"	"leningrado"	"chiapas"	-92.22919464	16.01034097
"casa ejidal"	"san antonio bawitz"	"casa"	""	"san antonio bawitz"	"san antonio bawitz"	"chiapas"	-92.09770203	16.49633647
"salon de usos multiples e.s.t. no."	"barrio linda vista"	"otros"	""	"lindavista vesubio"	"lindavista vesubio"	"chiapas"	-92.32910156	17.17949903
"iglecia catolica_de esquipulas                  "	"eloy ramirez lopez                  "	"otros"	""	"san antonio"	"san antonio"	"chiapas"	-92.41222932	15.146565
"iglesia bautista principe de paz"	"ra norte barrio los laureles"	"otros"	""	"el carmen"	"el carmen"	"chiapas"	-92.89283752	15.43250088
"escuela el recreo"	"col. el recreo"	"escuela"	""	"el recreo"	"el recreo"	"chiapas"	-92.33665466	17.18015504
"casa ejidal"	"com. san rafael    //"	"casa"	""	"amor de dios"	"amor de dios"	"chiapas"	-92.70388303	17.15044996
"parroquia de san pablo apostol"	"o.de mayo fte. al parque"	"otros"	""	"san jos"	"san jos"	"chiapas"	-92.80906677	16.55196172
"escuela primaria"	"com. rio colorado //"	"escuela"	""	"ro blanco"	"ro blanco"	"chiapas"	-92.70731625	17.14848161
"salon de usos multiples"	"nuevo momon"	"otros"	""	"nuevo momn"	"nuevo momn"	"chiapas"	-91.67322636	16.38489393
"esc. jose emilio grajales"	"milenio santa cruz"	"escuela"	""	"santa cruz"	"santa cruz"	"chiapas"	-93.20744748	15.68120451
"sec jose emilio grajales"	"barrio centro"	"otros"	""	"gracias a dios"	"gracias a dios"	"chiapas"	-92.93518053	16.69434372
"ermita san pedro"	"av. madero entre hidalgo y veracruz"	"otros"	""	"san pedro"	"san pedro"	"chiapas"	-92.80220032	16.55196172
"conalep"	"calle la libertad no  esq lib sur"	"otros"	""	"ro grande"	"ro grande"	"chiapas"	-93.01128398	16.69144746
"c.d.c. san pedro progresivo"	"av.chichonal esq.calle mactumacz s/n col.san pedro progresivo"	"otros"	""	"san pedro"	"san pedro"	"chiapas"	-93.10134874	16.75672297
"auditorio municipal"	"col. san marcos"	"auditorio"	""	"san marcos"	"san marcos"	"chiapas"	-93.36181641	16.76148151
"iglesia pentecostes"	"barrio nvo. chiapas"	"otros"	""	"barrio nuevo chiapas"	"barrio nuevo chiapas"	"chiapas"	-92.25219727	15.35782645
"esc. telesecundaria"	"ejido lazaro cardenas"	"escuela"	""	"lzaro crdenas del ro (cuatro vientos)"	"lzaro crdenas del ro (cuatro vientos)"	"chiapas"	-93.20401425	15.68384884
"esc. casa ejidal "	"ejido el fortin"	"escuela"	""	"el fortn"	"el fortn"	"chiapas"	-93.20744748	15.68186559
"esc. telesecundaria"	"c. carmelino villatoro reyes."	"escuela"	""	"la conquista"	"la conquista"	"chiapas"	-93.21019406	15.685171
"esc. primaria eraclio zepeda"	"ejido la conquista"	"escuela"	""	"la conquista"	"la conquista"	"chiapas"	-93.20058103	15.68384884
"saln de usos multiples san sebastian"	"barrio san sebastian"	"otros"	""	"san sebastin"	"san sebastin"	"chiapas"	-91.97891235	16.31486756
"esc secundaria no "	"av domingo ruiz no. entre   de febrero y juarez"	"escuela"	""	"santa cruz"	"santa cruz"	"chiapas"	-93.00304424	16.6973668
"casa ejidal"	"ejido las brisas"	"casa"	""	"las brisas"	"las brisas"	"chiapas"	-93.21019406	15.68384884
"casa ejidal"	"san miguel eureka //"	"casa"	""	"ninguno"	"ninguno"	"chiapas"	-93.38763448	17.18662195
"casa ejidal"	"cabecera municipal "	"casa"	""	"ninguno"	"ninguno"	"chiapas"	-93.3848879	17.18662195
"iglesia bautista rosa del saharn fracc. los angeles"	"iglesia bautista rosa del sarahon"	"otros"	""	"los ngeles"	"los ngeles"	"chiapas"	-92.25631714	14.90497601
"esc. primaria fral. luis chavez"	"fracc. los angeles"	"escuela"	""	"los ngeles"	"los ngeles"	"chiapas"	-92.25151062	14.90364892
"esc. primaria fral. luis chavez"	"fracc. los angeles"	"escuela"	""	"los ngeles"	"los ngeles"	"chiapas"	-92.25151062	14.90364892
"casa ejidal"	""	"casa"	""	"galeana dos"	"galeana dos"	"chiapas"	-93.21294065	15.68186559
"escuela primaria federal  ford no. "	" y  av. sur. ote"	"escuela"	""	"san francisco"	"san francisco"	"chiapas"	-93.212254	15.683188
"cobach plantel "	". sur ote."	"otros"	""	"san jos"	"san jos"	"chiapas"	-93.21912046	15.68186559
"esc, sec tecnica no "	". av, sur entre . y . ote."	"escuela"	""	"san jos"	"san jos"	"chiapas"	-93.209507	15.683849
"esc. primaria  federal  ford no. "	"calle central, entre .y . avenida sur pte"	"escuela"	""	"san felipe"	"san felipe"	"chiapas"	-93.206074	15.685832
"casa ejidal"	"jardines oriente y calle central col. centro"	"casa"	""	"cabecera municipal"	"cabecera municipal"	"chiapas"	-92.673142	15.340863
"esc. centenario de migracion japonesa"	"calle veracruz y nuevo len col. morelos ii"	"escuela"	""	"cabecera municipal"	"cabecera municipal"	"chiapas"	-92.67739074	15.33916588
"esc. prim. miguel  hidalgo"	"calle chiapas y durango barrio  de enero"	"escuela"	""	"cabecera municipal"	"cabecera municipal"	"chiapas"	-92.66322867	15.33937282
"parroquia san marcos"	"allende oriente y sinaloa, barrio jose luciano"	"otros"	""	"cabecera municipal"	"cabecera municipal"	"chiapas"	-92.6743513	15.33891991
"iglesia del buen pastor"	"sinaloa oriente y sonora ioriente"	"otros"	""	"cabecera municipal"	"cabecera municipal"	"chiapas"	-92.67511622	15.33854508
"iglesia de nazareno"	"sinaloa oriente y sonora oriente barrio jose luciano"	"otros"	""	"cabecera municipal"	"cabecera municipal"	"chiapas"	-92.674008	15.337471
"esc. prim. jose maria  morelosy pavon"	"barrio morelos iii"	"escuela"	""	"cabecera municipal"	"cabecera municipal"	"chiapas"	-93.00991069	16.6953937
"esc. prim. nios heroes"	"durango y sinaloa, barrio jose luciano"	"escuela"	""	"cabecera municipal"	"cabecera municipal"	"chiapas"	-92.67138259	15.33837954
"esc. prep belisario dominguez palencia"	"nuevo len oriente barrio morelos ii"	"escuela"	""	"cabecera municipal"	"cabecera municipal"	"chiapas"	-92.671383	15.33838
"ermita san isidro"	"av. mariano nango col. salomn gonzalezl.  de noviembre"	"otros"	""	"cabecera municipal"	"cabecera municipal"	"chiapas"	-92.81112671	16.55130353
"casa ejidal"	"av.grijalva y calle hidalgo barrio san pablo"	"casa"	""	"cabecera municipal"	"cabecera municipal"	"chiapas"	-92.80426025	16.54932894
"auditorio municipal"	"av.iluminada barrio candelaria"	"auditorio"	""	"cabecera municipal"	"cabecera municipal"	"chiapas"	-92.80014038	16.5532781
"ermita santa cruz"	"conocida, barrio la misin"	"otros"	""	"cabecera municipal"	"cabecera municipal"	"chiapas"	-92.79670715	16.5532781
"casa del pueblo (lopez mateos)"	"a.oriente norte col.adolfo lopez mateos"	"casa"	""	"cabecera municipal"	"cabecera municipal"	"chiapas"	-92.80632019	16.54998714
"ermita santa lucia"	"av. morelos, salida a chiapilla"	"otros"	""	"cabecera municipal"	"cabecera municipal"	"chiapas"	-92.8049469	16.5532781
"casa ejidal"	"com.mariano matamoros"	"casa"	""	"cabecera municipal"	"cabecera municipal"	"chiapas"	-92.52891541	15.39278379
"auditorio municipal"	"a. av. norte s/n y calle central"	"auditorio"	""	"cabecera municipal"	"cabecera municipal"	"chiapas"	-92.67691009	15.27423094
"esc. profr. mauro carrazco"	"a. poniente entre a y a orienteapata s/n col. soconusco"	"escuela"	""	"cabecera municipal"	"cabecera municipal"	"chiapas"	-92.68583648	15.27820525
"casa ejidal"	"av. central norte entre a y a ponientea. ote."	"casa"	""	"cabecera municipal"	"cabecera municipal"	"chiapas"	-92.68102996	15.27886763
"centro de convivencias"	"calle central y a. sur col. centro"	"otros"	""	"cabecera municipal"	"cabecera municipal"	"chiapas"	-92.68652313	15.28217948
"auditorio soconusco"	"av. vicente guerrero s/n col. francisco villa"	"auditorio"	""	"cabecera municipal"	"cabecera municipal"	"chiapas"	-92.68034332	15.28019237
"esc. prim. nios heroes"	"a calle poniente s/n col. centro"	"escuela"	""	"cabecera municipal"	"cabecera municipal"	"chiapas"	-92.68240325	15.27688049
"esc. prim. mariano matamoros"	"carretera matamoros emb. las garzas"	"escuela"	""	"cabecera municipal"	"cabecera municipal"	"chiapas"	-92.68858306	15.27754287
"casa ejidal"	"av. emiliano zapata  s/ncol. bonanza"	"casa"	""	"cabecera municipal"	"cabecera municipal"	"chiapas"	-92.67965667	15.27754287
"casa ejidal"	"calle central s/n. ejido colombia"	"casa"	""	"cabecera municipal"	"cabecera municipal"	"chiapas"	-92.68240325	15.28416656
"casa ejidal"	"carretera matamoros emb. las garzas s/n ejido mariano matamoros"	"casa"	""	"cabecera municipal"	"cabecera municipal"	"chiapas"	-92.68240325	15.27820525
"auditorio municipal"	"simn bolivar y calle central "	"auditorio"	""	"cabecera municipal"	"cabecera municipal"	"chiapas"	-92.82487546	17.36888667
"escuela prim. raul isidro burgos "	"calle morelos y calle central "	"escuela"	""	"cabecera municipal"	"cabecera municipal"	"chiapas"	-92.82144223	17.36560996
"no aplica"	"no aplica"	"otros"	""	"cabecera municipal"	"cabecera municipal"	"chiapas"	-92.81251584	17.37347397
"casa ejidal"	"simon bolivar s/n barrio guadalupe"	"casa"	""	"cabecera municipal"	"cabecera municipal"	"chiapas"	-92.81181335	17.37226535
"ejido monterrey"	"cabecera municpal"	"otros"	""	"cabecera municipal"	"cabecera municipal"	"chiapas"	-92.69096375	16.11509031
"esc. prep.jorge h. bedwell"	"cabecera municipal"	"escuela"	""	"cabecera municipal"	"cabecera municipal"	"chiapas"	-93.89808655	16.23247575
"esc. prim. francisco i. madero"	"cabecera municipal"	"escuela"	""	"cabecera municipal"	"cabecera municipal"	"chiapas"	-93.90194893	16.23247575
"iglesia adventista  dia"	"cabecera municipal"	"otros"	""	"cabecera municipal"	"cabecera municipal"	"chiapas"	-93.89456749	16.23577209
"esc. primaria belisario dominguez"	"calera"	"escuela"	""	"cabecera municipal"	"cabecera municipal"	"chiapas"	-93.90838623	16.23313503
"casa dia"	"cabecera municipal"	"casa"	""	"cabecera municipal"	"cabecera municipal"	"chiapas"	-93.89302254	16.23717302
"iglesia bautista emanuel"	"cabecera municipal"	"otros"	""	"cabecera municipal"	"cabecera municipal"	"chiapas"	-93.88710022	16.23115721
"escuela primaria emiliano zapata"	"cabecera municipal"	"escuela"	""	"cabecera municipal"	"cabecera municipal"	"chiapas"	-93.89259338	16.2337943
"unidad administrativa"	": avenida central y calle central"	"otros"	""	"cabecera municipal"	"cabecera municipal"	"chiapas"	-93.2605363	16.7946806
"auditorio municipal      "	". oriente sur s/n"	"auditorio"	""	"cabecera municipal"	"cabecera municipal"	"chiapas"	-93.270149	16.797967
"casa ejidal"	"calle central  sur s/n"	"casa"	""	"cabecera municipal"	"cabecera municipal"	"chiapas"	-93.10870718	16.75136196
"villa crisol"	"kil.. carretera tuxtla-berriozabal(vieja)."	"otros"	""	"cabecera municipal"	"cabecera municipal"	"chiapas"	-93.27549219	16.8025691
"esc.prim. federal nios heroes"	"calle central poniente s/n col.centro"	"escuela"	""	"cabecera municipal"	"cabecera municipal"	"chiapas"	-92.884598	16.998352
"jardin de nios diego rivera"	"a. norte oriente s/n. col.centro"	"escuela"	""	"cabecera municipal"	"cabecera municipal"	"chiapas"	-92.89833069	16.98915875
"auditorio municipal jicara de grillos."	"parque central, zona centro."	"auditorio"	""	"cabecera municipal"	"cabecera municipal"	"chiapas"	-92.90039063	16.99572544
"auditorio municipal juan sabines guerrero"	"barrio heberto castillo"	"auditorio"	""	"cabecera municipal"	"cabecera municipal"	"chiapas"	-92.89558411	16.99638209
