"nominm"	"nomvial"	"tipoinm"	"nomasen"	"nom_loc"	"nom_mun"	"nom_ent"	"lon"	"lat"
"capilla"	"la concepcion"	"otro"	"comunidad"	"loc. de la concepcion col. centro"	"ometepec"	"guerrero"	-98.259077	16.659853
"comisaria"	"arroyo de barranca honda"	"otro"	"comunidad"	"loc. arroyo de barranca honda"	"ometepec"	"guerrero"	-98.1925	16.4436
"iglesia"	"el limon"	"otro"	"comunidad"	"loc. el limon"	"ometepec"	"guerrero"	-98.438004	16.637702
"capilla"	"cuadrilla nueva"	"otro"	"comunidad"	"loc. cuadrilla nueva"	"ometepec"	"guerrero"	-98.1721	16.4121
"capilla"	"las palmas"	"otro"	"comunidad"	"loc. las palmas"	"ometepec"	"guerrero"	-98.205	16.3951
"auditorio"	"piedra del tigre"	"auditorio"	"comunidad"	"loc. piedra del tigre"	"ometepec"	"guerrero"	-98.2123	16.3938
"capilla"	"el potrerillo"	"otro"	"comunidad"	"loc. el potrerillo"	"ometepec"	"guerrero"	-98.2648	16.3432
"comisaria"	"san jose ejido"	"otro"	"comunidad"	"loc. de san jose ejido"	"ometepec"	"guerrero"	-98.2216	16.4232
"cbta "	"km.  carretera san luis acatlan hocacitas"	"escuela"	"comunidad"	"horcacitas"	"san luis acatlan"	"guerrero"	-99.733504	16.818846
"escuela primaria donaciano m. garzn"	"nio artillero"	"escuela"	"municipio"	"san luis acatlan"	"san luis acatlan"	"guerrero"	-98.726111	16.81159
"sec. tec. jose maria morelos y pavon"	"ruben dario"	"escuela"	"municipio"	"san luis acatlan"	"san luis acatlan"	"guerrero"	-98.739299	16.812507
"escuela primaria ignacio manuel altamirano"	"sarabia #"	"escuela"	"municipio"	"san luis acatlan"	"san luis acatlan"	"guerrero"	-98.73353	16.808374
"esc. sec. gralmiguel hidalgo y costilla"	"gabrial bernal"	"escuela"	"municipio"	"florencio villareal"	"florencio villareal"	"guerrero"	-98.121732	16.717543
"esc.prim.florencio villareal"	"playa larga"	"escuela"	"municipio"	"florencio villareal"	"florencio villareal"	"guerrero"	-98.133394	16.723423
"esc. prim. emiliano zapata"	"san juan de los llanos"	"escuela"	"comunidad"	"san juan de los llanos"	"igualapa"	"guerrero"	-98.501286	16.657903
"esc. prim. gral. nicolas bravo"	"la reforma"	"escuela"	"comunidad"	"la reforma"	"igualapa"	"guerrero"	-98.503044	16.693989
"auditorio municipal"	"tepatahuac"	"auditorio"	"comunidad"	"tepatahuac"	"igualapa"	"guerrero"	-98.2814	16.4142
"prim. ignacio zaragoza"	"iguala"	"escuela"	"municipio"	"igualapa"	"igualapa"	"guerrero"	-98.477433	16.741606
"esc. prim. est. \"cuahutemoc\""	"igualapa"	"escuela"	"municipio"	"igualapa"	"igualapa"	"guerrero"	-98.479086	16.746147
"casa del peregrino"	"igualapa"	"otro"	"municipio"	"igualapa"	"igualapa"	"guerrero"	-98.476225	16.745322
"esc. prim. fed. lazaro cardenaz"	"el capulin"	"escuela"	"comunidad"	"loc. el capulin"	"igualapa"	"guerrero"	-98.505475	16.736467
"jardn de nios \"amalia del castillo\""	"principal ayavitle"	"escuela"	"municipio"	"ajuchitlan del progreso"	"ajuchitlan del progreso"	"guerrero"	-100.502777	18.200833
"esc. sec. industrial nm. "	"carretera cd. altamirano -barrio cruz verde"	"escuela"	"municipio"	"ajuchitlan del progreso"	"ajuchitlan del progreso"	"guerrero"	-100.156666	18.163611
"esc. prim. gral. \"don vicente gro.\""	"san lorenzo"	"escuela"	"municipio"	"ajuchitlan del progreso"	"ajuchitlan del pregreso"	"guerrero"	-100.610555	18.271944
"esc. sec. industrial nm. "	"san cristbal"	"escuela"	"municipio"	"ajuchitlan del progreso"	"ajuchitlan del pregreso"	"guerrero"	-100.488888	18.175556
"esc. prim. \"lzaro crdenas\""	"zacahuaje"	"escuela"	"comunidad"	"zacahuaje"	"ajuchitlan del pregreso"	"guerrero"	-100.528611	18.200833
"esc. sec. gral. \"gabino barrera\""	"morelos"	"escuela"	"municipio"	"ajuchitlan del progreso"	"ajuchitlan del pregreso"	"guerrero"	-100.501111	18.155833
"comisaria municipal"	"lzaro crdenas"	"otro"	"municipio"	"ajuchitlan del progreso"	"ajuchitlan del pregreso"	"guerrero"	-100.504722	18.212778
"esc. prim. \"miguel hidalgo y costilla\""	"santa cecilia"	"escuela"	"municipio"	"ajuchitlan del progreso"	"ajuchitlan del pregreso"	"guerrero"	-100.562777	18.247778
"iglesia santsima cruz"	"el reparo"	"otro"	"comunidad"	"el reparo"	"ajuchitlan del pregreso"	"guerrero"	-100.485277	18.159444
"esc. prim. \"vicente guerrero\""	"santa rosa de lima"	"escuela"	"comunidad"	"santa rosa"	"ajuchitlan del pregreso"	"guerrero"	-100.584722	18.163889
"capilla del chalma"	"ajuchitlan del progreso"	"otro"	"municipio"	"ajuchitlan del progreso"	"ajuchitlan del pregreso"	"guerrero"	-100.418611	18.159444
"esc. prim. \"i.m.a.\""	"ejido"	"escuela"	"municipio"	"ajuchitlan del progreso"	"ajuchitlan del pregreso"	"guerrero"	-100.503888	18.15
"esc. prim. ramn \"v\" lvarez."	"custodio hernndez no. "	"escuela"	"municipio"	"ajuchitlan del progreso"	"ajuchitlan del pregreso"	"guerrero"	-100.496666	18.160278
"colegio de bachilleres de villa nicols"	"villa nicols bravo"	"escuela"	"municipio"	"ajuchitlan del progreso"	"ajuchitlan del pregreso"	"guerrero"	-100.556944	18.214167
"jardn de nios  de marzo"	"esq. ejido"	"escuela"	"municipio"	"ajuchitlan del progreso"	"ajuchitlan del pregreso"	"guerrero"	-100.503333	18.15
"esc. abrahan lincon"	"san mateo"	"escuela"	"municipio"	"ajuchitlan del progreso"	"ajuchitlan del pregreso"	"guerrero"	-100.513888	18.1975
"esc. preparatoria no. "	"carretera ajuchitlan - ciudad altamirano"	"escuela"	"municipio"	"ajuchitlan del progreso"	"ajuchitlan del pregreso"	"guerrero"	-100.506388	18.164722
"esc. sec. federal gral. joaqun baranda"	"leandro valle"	"escuela"	"municipio"	"ajuchitlan del progreso"	"ajuchitlan del pregreso"	"guerrero"	-100.585277	18.271389
"casa ejidal"	"san jos poliutla"	"otro"	"comunidad"	"san jos poliutla"	"tlapehuala"	"guerrero"	-100.2314	18.1617
"cancha techada"	"san juan mina"	"deportivo"	"comunidad"	"san juan mina"	"tlapehuala"	"guerrero"	-100.5308	18.2425
"comisaria municipal"	"ignacio zaragoza"	"otro"	"municipio"	"tlapehuala"	"tlapehuala"	"guerrero"	-100.3159	18.1421
"esc. sec. tc. no. "	"revolucin"	"escuela"	"municipio"	"san miguel totolapan"	"san miguel totolapan"	"guerrero"	-100.385908	18.158372
"colegio de bachilleres plantel no. "	"emiliano zapata #"	"escuela"	"municipio"	"san miguel totolapan"	"san miguel totolapan"	"guerrero"	-100.387386	18.161414
"jardn de n. el mundo de los nios"	"calle heroico colegio militar"	"escuela"	"municipio"	"san miguel totolapan"	"san miguel totolapan"	"guerrero"	-100.363774	18.173969
"saln villa albatros"	"independencia # "	"otro"	"municipio"	"arcelia"	"arcelia"	"guerrero"	-100.286605	18.315342
"pista ejidal"	"rayn"	"recreativo"	"municipio"	"arcelia"	"arcelia"	"guerrero"	-100.277647	18.316506
"esc. prim. benito jurez"	"francisco arce #"	"escuela"	"municipio"	"arcelia"	"arcelia"	"guerrero"	-100.283872	18.315369
"esc. prim. gral r. leyva mancilla"	"guerrero"	"escuela"	"municipio"	"arcelia"	"arcelia"	"guerrero"	-100.2833	18.315625
"saln villa albatros"	"independencia # "	"otro"	"municipio"	"arcelia"	"arcelia"	"guerrero"	-100.286403	18.315323
"esc. prim. francisco javier mina"	"emiliano zapata"	"escuela"	"comunidad"	"tlalchapa"	"tlalchapa"	"guerrero"	-100.478538	18.409633
"esc. prim. donaciano gutirrez garduo"	"ignacio zaragoza"	"escuela"	"comunidad"	"tlalchapa"	"tlalchapa"	"guerrero"	-100.479695	18.409807
"h. ayuntamiento mpal."	"ayuntamiento"	"otro"	"comunidad"	"tlalchapa"	"tlalchapa"	"guerrero"	-100.478239	18.409015
"esc. sec. gral. lzaro crdenas"	"lzaro crdenas"	"escuela"	"municipio"	"coyuca de cataln"	"coyuca de cataln"	"guerrero"	-100.646725	18.283539
"unidad deportiva"	"fed. coyuca-zihuatanejo"	"deportivo"	"municipio"	"coyuca de cataln"	"coyuca de cataln"	"guerrero"	-100.711147	18.332961
"auditorio municipal"	"ignacio zaragoza"	"auditorio"	"municipio"	"coyuca de cataln"	"coyuca de cataln"	"guerrero"	-100.701633	18.331542
"esc. lic. benito jurez garca"	"nuno"	"escuela"	"municipio"	"coyuca de cataln"	"cutzamala de pinzn"	"guerrero"	-100.3449	18.28
"esc. sec. tec. #"	"fed. toluca-altamirano"	"escuela"	"municipio"	"coyuca de cataln"	"cutzamala de pinzn"	"guerrero"	-100.583074	18.462227
"esc. prim. miguel hidalga i. costilla"	"municipio libre"	"escuela"	"municipio"	"coyuca de cataln"	"cutzamala de pinzn"	"guerrero"	-100.580966	18.468366
"colegio de bachilleres plantel"	"aviacin"	"escuela"	"municipio"	"zirandaro de los chvez"	"zirandaro de los chvez"	"guerrero"	-100.982333	18.474642
"esc. sec. tec. # dr. ignacio chvez"	"narciso mendoza nm. "	"escuela"	"municipio"	"zirandaro de los chvez"	"zirandaro de los chvez"	"guerrero"	-100.978888	18.474178
"esc. prim. vicente riva palacio"	"lzaro crdenas nm. o"	"escuela"	"municipio"	"zirandaro de los chvez"	"zirandaro de los chvez"	"guerrero"	-100.979911	18.477678
"esc. prim. alberto reyes"	"narciso mendoza nm. ,"	"escuela"	"municipio"	"zirandaro de los chvez"	"zirandaro de los chvez"	"guerrero"	-100.976458	18.475036
"terrenos de la expo"	""	"recreativo"	"municipio"	"pungarabato"	"pungarabato"	"guerrero"	-100.67693	18.359932
"club de leones"	"coyuca"	"otro"	"municipio"	"pungarabato"	"pungarabato"	"guerrero"	-100.671747	18.35324
"templo cielos abiertos"	"coyuca"	"otro"	"municipio"	"pungarabato"	"pungarabato"	"guerrero"	-100.687275	18.335014
"escuela cecytem "	"km. . carretera lzaro crdenas la mira"	"escuela"	"guacamayas"	"guacamayas"	"lzaro crdenas"	"michoacn de ocampo"	-102.14754	18.00247
"esc. sec. tec. no. "	"km.  lzaro crdenas la mira"	"escuela"	"buenos aires"	"buenos aires"	"lzaro crdenas"	"michoacn de ocampo"	-102.27812	18.01845
"esc. prim. republica de argentina"	"carretera la mira playa azul km. "	"escuela"	"la mira"	"la mira"	"lzaro crdenas"	"michoacn de ocampo"	-102.19769	18.0198
"esc. prim. lzaro crdenas"	"clle marmol s/n col. centro"	"escuela"	"la mira"	"la mira"	"lzaro crdenas"	"michoacn de ocampo"	-102.19769	18.02259
"esc. prim. lzaro crdenas"	"calle habillo s/n col. centro"	"escuela"	"el habillal"	"el habillal"	"lzaro crdenas"	"michoacn de ocampo"	-102.22356	18.00452
"esc. prim. primo tapia"	"domicilio conocido sobre carretera nacional"	"escuela"	"chucutitan"	"chucutitan"	"lzaro crdenas"	"michoacn de ocampo"	-102.27893	18.01378
"esc. cecytem "	"carretera manzanillo km. "	"escuela"	"chucutitan"	"chucutitan"	"lzaro crdenas"	"michoacn de ocampo"	-102.27894	18.01342
"esc. prim. jaime torres bodet"	"domicilio conocido chuquiapan"	"escuela"	"chuquiapan"	"chuquiapan"	"lzaro crdenas"	"michoacn de ocampo"	-102.36317	18.032
"esc. revindicacion petrolera"	"boulevard paseo de los insurgentes"	"escuela"	"caleta de campos"	"caleta de campos"	"lzaro crdenas"	"michoacn de ocampo"	-102.4525	18.0428
"esc. prim . leona vicario"	"entre la calle a la clinica y el rio del pueblo"	"refugio"	""	""	"guevea de humboldt"	"oaxaca"	-95.366331	16.792122
"saln de usos mltiples"	"a un costado de la conasupo y la carretera rumbo al centro de la poblacin"	"recreativo"	""	""	"guevea de humboldt"	"oaxaca"	-95.368225	16.792721
"esc. prim. benito jurez"	"en el centro de la poblacin a un costado del palacio municipal"	"escuela"	""	""	"guevea de humboldt"	"oaxaca"	-95.367516	16.795371
"auditorio municipal"	"ubicado en la calle hidalgo s/n en el barrio centro frente al palacio municipal"	"escuela"	""	""	"magdalena tequisitln"	"oaxaca"	-95.598711	16.399286
"casa de la cultura"	"ubicada en ave. tehuantepec s/n barrio centro"	"casa"	""	""	"magdalena tequisitln"	"oaxaca"	-95.603234	16.401272
"escuela secundaria tecnica no. "	"ubicada en la avenida tehuantepc s/n barrio nuevo"	"escuela"	""	""	"magdalena tequisitln"	"oaxaca"	-95.597677	16.403302
"centro de bachillerato tecnologico agropecuario no."	"ubicado en calle buenos aires s/n barrio linda vista"	"escuela"	""	""	"magdalena tequisitln"	"oaxaca"	-95.596967	16.40169
"escuela primaria oaxaca"	"ubicada en ave. tehuantepec s/n del barrio nuevo"	"escuela"	""	""	"magdalena tequisitln"	"oaxaca"	-95.600109	16.402738
"escuela primaria lazaro cardenas"	"ubicada en ave. lazaro cardenas s/n barrio de guadalupe"	"escuela"	""	""	"magdalena tequisitln"	"oaxaca"	-95.609573	16.398977
"escuela primaria arcadio g. molina"	"ubicado en el centro de la poblacion domicilio conocido"	"escuela"	""	""	"san blas atempa"	"oaxaca"	-95.221933	16.325023
"escuela primaria lic. emilio garcia"	"francisco cortes s/n"	"escuela"	""	""	"san blas atempa"	"oaxaca"	-95.221207	16.325158
"iglesia san pedro shihui"	"calle mateo jimenez sin numero a un costado del palacio municipal"	"otro"	""	""	"san blas atempa"	"oaxaca"	-95.227833	16.325766
"iglesia san blas"	"francisco cortes s/n"	"otro"	""	""	"san blas atempa"	"oaxaca"	-95.229516	16.326569
"preescolar julio de la fuente"	"ubicado en la calle miguel hidalgo en el centro."	"escuela"	""	""	"san blas atempa"	"oaxaca"	-95.228025	16.326952
"dif municipal"	"ubicado en carretera camino a santa rosa"	"refugio"	""	""	"san blas atempa"	"oaxaca"	-95.213778	16.325323
"escuela enrique c. rebsamen"	"avenida istmo s/n"	"escuela"	""	""	"san miguel tenango"	"oaxaca"	-95.592487	16.267604
"escuela secundaria benito juarez"	"avenida istmo s/n"	"escuela"	""	""	"san miguel tenango"	"oaxaca"	-95.586991	16.267186
"preescolar benito jurez"	"avenida istmo s/n"	"escuela"	""	""	"san miguel tenango"	"oaxaca"	-95.593242	16.267768
"escuela primaria  de octubre"	"avenida flores magn s/n ."	"escuela"	""	""	"san pedro comitancillo"	"oaxaca"	-95.152624	16.48983
"esc. prim. juan b. toledo"	"av. centenario s/n col. centro"	"escuela"	""	""	"san pedro comitancillo"	"oaxaca"	-95.159986	16.490135
"ayuntamiento municipal"	"calle centenario colonia centro ."	"auditorio"	""	""	"san pedro comitancillo"	"oaxaca"	-95.159731	16.49035
"escuela preescolar  de mayo"	"valle buenos aires domicilio conocidio."	"refugio"	""	""	"san pedro huilotepec"	"oaxaca"	-95.15118	16.246804
"auditorio municipal"	"calle independencia colonia centro."	"refugio"	""	""	"san pedro huilotepec"	"oaxaca"	-95.152892	16.243956
"explanada de la iglesia de la poblacin"	"calle independencia colonia centro."	"refugio"	""	""	"san pedro huilotepec"	"oaxaca"	-95.152647	16.243904
"bachillerato del iebo plantel "	"ubicado en la calle manzanillo"	"refugio"	""	""	"san pedro huilotepec"	"oaxaca"	-95.143113	16.246929
"auditorio municipal"	"ubicado en el centro de la poblacion a un costado del palacio municipal"	"refugio"	""	""	"santa mara jalapa del marquz"	"oaxaca"	-95.44334	16.440022
"domo municipal sara valero de marines"	"centro de la poblacion frente a palacio municipal"	"refugio"	""	""	"santa mara jalapa del marquz"	"oaxaca"	-95.44286	16.439816
"escuela primaria heroes nacionales"	"ubicado en ave.  norte sin numero frente a la glorieta ignacio zaragoza. barrio el rosario"	"refugio"	""	""	"santa mara jalapa del marquz"	"oaxaca"	-95.443444	16.443523
"escuela primaria pino suarez"	"ubicada en ave. pino suarez s/n colonia aguascalientes"	"refugio"	""	""	"santa mara jalapa del marquz"	"oaxaca"	-95.44355	16.434958
"escuela preparatoria cobao plantel "	"ubicado en la carretera transismica cristobal colon km +"	"refugio"	""	""	"santa mara jalapa del marquz"	"oaxaca"	-95.464869	16.440354
"escuela primaria lazaro cardenas"	"domicilio conocido centro de la poblacin"	"refugio"	""	""	"santa mara mixtequilla"	"oaxaca"	-95.2566	16.376251
"escuela primaria jose maria morelos y pavon"	"domicilio conocido centro de la poblacin"	"refugio"	""	""	"santa mara mixtequilla"	"oaxaca"	-95.258365	16.37637
"auditorio municipal"	"ubicado en calle miguel hidalgo s/n centro totolapilla"	"refugio"	""	""	"santa mara totolapilla"	"oaxaca"	-95.625135	16.602454
"mercado publico"	"ubicado en calle miguel hidalgo centro sta. ma. totolapilla planta baja."	"refugio"	""	""	"santa mara totolapilla"	"oaxaca"	-95.625062	16.602727
"cancha municipal"	"calzada heladio ramirez lopez centro"	"refugio"	""	""	"santiago astata"	"oaxaca"	-95.676525	15.987187
"palacio municipal"	"calzada heladio ramirez lopez centro"	"refugio"	""	""	"santiago astata"	"oaxaca"	-95.676797	15.986906
"mercado municipal"	"ubicado en donde termina la calzada heladio ramirez lopez centro"	"refugio"	""	""	"santiago astata"	"oaxaca"	-95.676547	15.986894
"escuela primaria odilon pion ramirez"	"colonia benito juarez domicilio conocido"	"refugio"	""	""	"santiago astata"	"oaxaca"	-95.676372	15.986702
"iglesia catolica de la poblacion"	"centro de la poblacin"	"refugio"	""	""	"santiago astata"	"oaxaca"	-95.676654	15.987077
"casa de la cultura"	"ubicada en avenida tehuantepec s/n"	"refugio"	""	""	"santiago laollaga"	"oaxaca"	-95.204747	16.584566
"palacio municipal"	"ubicado en av. tehuantepec s/n"	"refugio"	""	""	"santiago laollaga"	"oaxaca"	-95.205053	16.584382
"iglesia ctlica"	"ubicada en av. tehuantepec s/n"	"refugio"	""	""	"santiago laollaga"	"oaxaca"	-95.204905	16.584812
"esc. prim. benito jurez"	"calle  de mayo s/n barrio san juan"	"refugio"	""	""	"santo domingo chihuitan"	"oaxaca"	-95.164197	16.587555
"auditrorio municipal"	"entre avenida vicente guerrero s/n y avenida benito juarez"	"refugio"	""	""	"santo domingo chihuitan"	"oaxaca"	-95.16635483	16.590557
"iglesia catlica"	"ubicada entre la calle morelos,galeana y miguel hidalgo"	"refugio"	""	""	"santo domingo chihuitan"	"oaxaca"	-95.161401	16.592136
"casa del pueblo"	"entre la calle morelos y francisco i madero barrio el rosario"	"refugio"	""	""	"santo domingo chihuitan"	"oaxaca"	-95.16098552	16.59191379
"esc. telesecundaria"	"ubicado entre avenida benito juarez s/n barrio el cerrito y el panteon municipal"	"refugio"	""	""	"santo domingo chihuitan"	"oaxaca"	-95.171749	16.588408
"palacio municipal"	"ubicado entre independencia y miguel hidalgo"	"refugio"	""	""	"santo domingo chihuitan"	"oaxaca"	-95.16254591	16.59180021
"comisariado de bienes comunales"	"ubicado entre galeana y miguel hidalgo"	"refugio"	""	""	"santo domingo chihuitan"	"oaxaca"	-95.161231	16.591594
"casa de la cultura"	"calle guerrero s/n barrio san sebastian"	"refugio"	""	""	"santo domingo tehuantepec"	"oaxaca"	-95.230613	16.334066
"casa de dia"	"boulevard lupita hinojosa de murat"	"refugio"	""	""	"santo domingo tehuantepec"	"oaxaca"	-95.37950605	16.09667756
"palacio municipal"	"avemida  de mayo colonia centro"	"refugio"	""	""	"santo domingo tehuantepec"	"oaxaca"	-95.232944	16.332269
"casa comunal del barrio de santa cruz tagolaba"	"calle del deporte s/n"	"refugio"	""	""	"santo domingo tehuantepec"	"oaxaca"	-95.237506	16.318266
"casa comunal del barrio lieza"	"ubicada en el barrio lieza y calle aquiles serdan"	"refugio"	""	""	"santo domingo tehuantepec"	"oaxaca"	-95.239913	16.329512
"atrio de la iglesia del barrio san jeronimo"	"calle colon s/n"	"refugio"	""	""	"santo domingo tehuantepec"	"oaxaca"	-95.229363	16.335468
"atrio de la iglesia del barrio san sebastian"	"calle aldama s/n."	"refugio"	""	""	"santo domingo tehuantepec"	"oaxaca"	-95.229129	16.335436
"escuela vieja de la agencia morro mazatan"	"domicilio conocido centro de la poblacin"	"refugio"	""	""	"santo domingo tehuantepec"	"oaxaca"	-95.377937	16.100767
"domo agencia santa gertrudis miramar"	"domicilio conocido centro de la poblacin"	"refugio"	""	""	"santo domingo tehuantepec"	"oaxaca"	-95.390261	16.063051
"campo de base ball agricultura"	"calle ixtaltepec barrio vixana"	"refugio"	""	""	"santo domingo tehuantepec"	"oaxaca"	-95.223743	16.342453
"auditorio municipal panfilo antonio toledo"	"ubicado en avenida independencia s/n en la quinta seccion."	"refugio"	""	""	"asuncin ixtaltepec"	"oaxaca"	-95.052436	16.503627
"la pista santa rita sur"	"ubicado en la ave. jesus rasgado esquina con santa rita"	"refugio"	""	""	"asuncin ixtaltepec"	"oaxaca"	-95.06296	16.505935
"escuela primaria felipe mendoza"	"ubicada en la calle  de septiembre s/n de la quinta seccion"	"refugio"	""	""	"asuncin ixtaltepec"	"oaxaca"	-95.051319	16.504149
"escuela primaria jesus rasgado"	"ubicada en ave. revolucin esq. con  de febrero sexta seccion"	"refugio"	""	""	"asuncin ixtaltepec"	"oaxaca"	-95.047553	16.509714
"mercado municipal jesus rasgado"	"ubicado en el centro de la poblacin"	"refugio"	""	""	"asuncin ixtaltepec"	"oaxaca"	-95.056919	16.503031
"preescolar dominga guzman rasgado"	"ubicado en la calle centenario en el centro"	"refugio"	""	""	"asuncin ixtaltepec"	"oaxaca"	-95.05936	16.503794
"escuela primaria presidente juarez"	"ubicada en ave. jurez y galeana no.  de la  seccion."	"refugio"	""	""	"asuncin ixtaltepec"	"oaxaca"	-95.062561	16.499898
"parroquia asunsin de maria"	"ubicada en el centro de la poblacion"	"refugio"	""	""	"asuncin ixtaltepec"	"oaxaca"	-95.056084	16.503858
"parque benito juarez"	"ubicado en calle benito juarez"	"refugio"	""	""	"barriode la soledad"	"oaxaca"	-95.111713	16.804235
"escuela primaria melchor ocampo"	"ubicada en el centro de la poblacion"	"refugio"	""	""	"barriode la soledad"	"oaxaca"	-95.112253	16.804872
"casa del pueblo"	"ubicada en calle benito juarez s/n"	"refugio"	""	""	"barriode la soledad"	"oaxaca"	-95.112118	16.804278
"salon comunal"	"ubicado en prolongacion benito juarez rumbo a la salida hacia lagunas oaxaca"	"refugio"	""	""	"barriode la soledad"	"oaxaca"	-95.112224	16.804268
"explanada del registro civil"	"ubicado en la calle sin nombre col. tercera seccion"	"refugio"	""	""	"barriode la soledad"	"oaxaca"	-95.111393	16.800706
"jardin de nios melchor ocampo"	"ubicado en calle heliodoro charis castro"	"refugio"	""	""	"barriode la soledad"	"oaxaca"	-95.108495	16.804674
"dif municipal"	"ubicado en la calle nicolas bravo entre pensador mexicano y correjidora"	"refugio"	""	""	"cd. ixtepec"	"oaxaca"	-95.098084	16.554875
"auditorio municipal"	"ubicado en la calle de galeana entre cuauhtemoc y antigua pista"	"refugio"	""	""	"cd. ixtepec"	"oaxaca"	-95.104505	16.555908
"casa de la cultura."	"ubicada en la calle  de septiembre entre juarez y constitucion"	"refugio"	""	""	"cd. ixtepec"	"oaxaca"	-95.09802	16.566
"centro de atencion infantil comunitario (extensin del dif"	"ubicado en calle independia s/n. en el centro de la poblacion"	"refugio"	""	""	"cd. ixtepec"	"oaxaca"	-95.09844387	16.55931399
"casino municipal saln para eventos especiales"	"calle  de septiembre entre libertad y av. agricultura colonia centro ."	"refugio"	""	""	"chahuites"	"oaxaca"	-94.194871	16.288613
"jardn de nios chahuites."	"esquina hidalgo y av. ayuntamiento colonia centro."	"refugio"	""	""	"chahuites"	"oaxaca"	-94.196961	16.287601
"esc. prim. guadalupe victoria"	"calle virgen de la guadalupe y boulevard colonia guadalupe."	"refugio"	""	""	"chahuites"	"oaxaca"	-94.192878	16.303322
"esc. prim. ricardo flores magn"	"calle constitutcin s/n colonia san antonio"	"refugio"	""	""	"chahuites"	"oaxaca"	-94.186466	16.296472
"esc. sec. tcnica no. "	"calle virgen de la soledad colonia guadalupe"	"refugio"	""	""	"chahuites"	"oaxaca"	-94.192768	16.30437
"mercado pblico"	"ubicado en calle hidalgo y avenida juarez s/n"	"refugio"	""	""	"el espinal"	"oaxaca"	-95.04281	16.485126
"templo catlico"	"ubicado en calle porfirio daz entre zaragoza y jurez"	"refugio"	""	""	"el espinal"	"oaxaca"	-95.04395	16.484509
"auditorio de la presidencia municipal"	"ubicado en calle hidalgo entre avenida juarez y colon"	"refugio"	""	""	"el espinal"	"oaxaca"	-95.042896	16.485797
"biblioteca pblica"	"ubicado en avenida colon y y porfirio diaz"	"refugio"	""	""	"el espinal"	"oaxaca"	-95.043736	16.486091
"esc. prim. abraham castellanos"	"ubicado en calle porfirio daz entre zaragoza y jurez"	"refugio"	""	""	"el espinal"	"oaxaca"	-95.044004	16.483767
"esc. prim. luis b toledo"	"ubicado en ave. melchor o campo y calle francisco y madero"	"refugio"	""	""	"el espinal"	"oaxaca"	-95.038102	16.488116
"esc. sec. tcnica # "	"ubicada entre avenida independencia y guadalupe victoria"	"refugio"	""	""	"el espinal"	"oaxaca"	-95.038997	16.489723
"centro escolar juchitn."	"frente al parque revolucin."	"refugio"	""	""	"heroica juchitn de zaragoza"	"oaxaca"	-95.023988	16.431583
"esc. sec. fed. heliodoro charis castro"	"ubicado en en la a. seccin calle venecia s/n"	"refugio"	""	""	"heroica juchitn de zaragoza"	"oaxaca"	-95.031018	16.431987
"esc. prim. hroes  de septiembre"	"en la esq. calle oaxaca y  de septiembre."	"refugio"	""	""	"heroica juchitn de zaragoza"	"oaxaca"	-95.022349	16.442607
"hospital macedonio para albergar a mujeres embarazadas"	"ubicado frente al panten domingo de ramos ."	"refugio"	""	""	"heroica juchitn de zaragoza"	"oaxaca"	-95.013205	16.433651
"instituto tecnolgico del istmo"	"ubicado en calz. tecnolgico segunda seccion."	"refugio"	""	""	"heroica juchitn de zaragoza"	"oaxaca"	-95.016988	16.445438
"salon silva"	"ubicado en la calle independencia cxasi esq. con calle union colorina rincon viejo norte"	"refugio"	""	""	"matas romero"	"oaxaca"	-95.041212	16.886192
"salon bejin"	"ubicado en la calle morelos entre industria y justo sierra col. centro"	"refugio"	""	""	"matas romero"	"oaxaca"	-95.041473	16.873584
"salon cristina"	"ubicado en la calle  de mayo entre cuauhtemoc y porfirio diaz col. centro"	"refugio"	""	""	"matas romero"	"oaxaca"	-95.036829	16.880038
"iglesia de san matias apostol"	"ubicada en la calle allende entre corregidora y reforma col. centro"	"refugio"	""	""	"matas romero"	"oaxaca"	-95.041934	16.87613
"salon de los tehuanos"	"ubicado en la calle ejido norte esq. con iturbide col. centro."	"refugio"	""	""	"matas romero"	"oaxaca"	-95.036754	16.877738
"auditorio municipal"	"ubicado entre la calle  de septiembre esq. con industria col. centro"	"refugio"	""	""	"matas romero"	"oaxaca"	-95.04415	16.875695
"auditorio municipal"	"ubicado en ave. reforma sin numero"	"refugio"	""	""	"reforma de pineda"	"oaxaca"	-94.458227	16.399364
"dif municipal"	"ubicado en ave. reforma sin numero"	"refugio"	""	""	"reforma de pineda"	"oaxaca"	-94.458428	16.398933
"escuela primaria ignacio zaragoza"	"ubicada en la ave. porfirio diaz s/n"	"refugio"	""	""	"reforma de pineda"	"oaxaca"	-94.45885	16.397512
"casa de ancianos"	"ubicada en calle  de septiembre esquina avenida juarez"	"refugio"	""	""	"san dionisio del mar"	"oaxaca"	-94.757601	16.3231
"oficina comisariado de bienes comunales"	"ubicada en calle ignacio zaragosa esq. zapata"	"refugio"	""	""	"san dionisio del mar"	"oaxaca"	-94.757393	16.323688
"auditorio municipal"	"ubicado en la calle ignacio zaragoiza centro"	"refugio"	""	""	"san dionisio del mar"	"oaxaca"	-94.757182	16.320553
